<?xml version="1.0" encoding="UTF-8"?>
<!DOCTYPE TEI SYSTEM "dtd.dtd">
<TEI xmlns="http://www.tei-c.org/ns/1.0">
  <teiHeader>
     <fileDesc>
        <titleStmt>
           <title></title>
        </titleStmt>
        <editionStmt>
           <edition></edition>
           <respStmt>
              <resp></resp>
              <name></name>
           </respStmt>
        </editionStmt>
        <publicationStmt>
           <distributor></distributor>
           <date></date>
           <availability>
              <licence>
                 <ref/>
              </licence>
           </availability>
        </publicationStmt>
        <sourceDesc>
            <p></p>
        </sourceDesc>
     </fileDesc>
     
     <encodingDesc>
        <projectDesc>
           <p></p>
        </projectDesc>
        <samplingDecl>
           <p></p>
        </samplingDecl>
     </encodingDesc>
     
     <!-- VERIFIER TOUT CA -->
     <profileDesc> 
        <langUsage>
           <language ident=""></language>
        </langUsage>
        <textDesc n="">
           <channel></channel>
           <constitution/>
           <derivation/>
           <domain/>
           <factuality></factuality>
           <interaction></interaction>
           <preparedness></preparedness>
           <purpose></purpose>
        </textDesc>
     </profileDesc>
 
  </teiHeader>
  
   
   <text>
      <body>
         <head></head>
         <div>
            <head></head>
            <pb/>
            <fw></fw>
            <entry>
               <form>
                  <orth></orth>
                  <gramGrp>
                     <gen></gen>
                     <pos></pos>
                     <number></number>
                  </gramGrp>
               </form>
               <sense></sense>
               <cit type="translation" xml:lang="en">
                  <quote>horrifier</quote>
               </cit>
               <cit type="example">
                  <quote>she was horrified at the expense.</quote>
                  <cit type="translation" xml:lang="en">
                     <quote>elle était horrifiée par la dépense.</quote>
                  </cit>
                </cit>
              </entry>
         </div>
      </body>
  </text>
</TEI>
